ticker,company,source_type,source_type_raw,url,canonical_url,coverage_note,has_dates,has_full_text,needs_js,notes,source_input_file,duplicate_input_rows,review_likely_value,review_vendor_profile,review_http_status,review_q4_years_2010_2023,crawler_grade,robots_policy,dedupe_key
MSFT,Microsoft Corporation,company_financial_report_archive,annual_reports,https://www.microsoft.com/en-us/investor/annual-reports,https://www.microsoft.com/en-us/investor/annual-reports,Official Microsoft annual reports archive with full reports from 2010-era through current.,yes,yes,no,Full annual-report documents; useful long-history supplement.,official_ir_sources_29_dow_tickers.csv,1,high_static_candidate,q4_or_q4_like,200,,crawler_ready,Use official company pages; respect robots and rate limits.,MSFT|https://www.microsoft.com/en-us/investor/annual-reports
MSFT,Microsoft Corporation,company_financial_report_archive,annual_reports_archive,https://www.microsoft.com/investor/reports/ar25/index.html,https://www.microsoft.com/investor/reports/ar25/index.html,Official Microsoft annual report series. Current year page is here and older years follow the same official investor reports structure.,yes,yes,no,Useful backup for financial history,deep_research_report_10_official_ir_sources.csv,1,high_static_or_wp_candidate,static_html_or_custom,200,,crawler_ready,Use official company pages; respect robots and rate limits.,MSFT|https://www.microsoft.com/investor/reports/ar25/index.html
MSFT,Microsoft Corporation,company_presentation_archive,investor_events|investor_presentations_archive,https://www.microsoft.com/en-us/investor/events/default,https://www.microsoft.com/en-us/investor/events/default,Official Microsoft investor events page with dated past/upcoming events and earnings calls. | Official Microsoft investor events and presentations archive with past events pages.,yes,yes,no,Use event dates and linked earnings files. | Useful for earnings and conference materials,deep_research_report_10_official_ir_sources.csv|official_ir_sources_29_dow_tickers.csv,2,high_static_candidate,q4_or_q4_like,200,,crawler_ready,Use official company pages; respect robots and rate limits.,MSFT|https://www.microsoft.com/en-us/investor/events/default
MSFT,Microsoft Corporation,company_press_release_archive,company_news_archive,https://news.microsoft.com/source/tag/press-releases/,https://news.microsoft.com/source/tag/press-releases/,Official Microsoft press release archive with very large dated archive and full text pages.,yes,yes,no,Official company newsroom archive,deep_research_report_10_official_ir_sources.csv,1,high_static_or_wp_candidate,wordpress,200,,crawler_ready,Use official company pages; respect robots and rate limits.,MSFT|https://news.microsoft.com/source/tag/press-releases/
PG,The Procter & Gamble Company,company_financial_report_archive,annual_reports,https://www.pginvestor.com/financials/annual-reports/default.aspx,https://www.pginvestor.com/financials/annual-reports/default.aspx,Official P&G annual reports archive with full annual reports from 2010 through current.,yes,yes,no,Strong long-history annual-report source.,official_ir_sources_29_dow_tickers.csv,1,high_static_candidate,q4_or_q4_like,200,,crawler_ready,Use official company pages; respect robots and rate limits.,PG|https://www.pginvestor.com/financials/annual-reports/default.aspx
UNH,UnitedHealth Group Incorporated,company_financial_report_archive,archive_hub|investor_archive,https://www.unitedhealthgroup.com/investors/archive.html,https://www.unitedhealthgroup.com/investors/archive.html,"Official UnitedHealth Group investor archive for older annual reports, quarterly releases and shareholder materials. | Official archive page for dividends earnings annual reports and filings. Search results explicitly describe historical archive coverage.",yes,yes,no,Important source for older Train-period coverage before 2020. | Useful historical backup source,deep_research_report_10_official_ir_sources.csv|official_ir_sources_29_dow_tickers.csv,2,high_static_candidate,static_html_or_custom,200,,crawler_ready,Use official company pages; respect robots and rate limits.,UNH|https://www.unitedhealthgroup.com/investors/archive.html
UNH,UnitedHealth Group Incorporated,company_financial_report_archive,financial_reports|financial_reports_archive,https://www.unitedhealthgroup.com/investors/financial-reports.html,https://www.unitedhealthgroup.com/investors/financial-reports.html,Official UnitedHealth Group financial reports page with annual and quarterly materials; prior-to-2020 items linked through archive. | Official financial reports page with earnings releases quarterly and annual reports. Strong recent coverage from 2020s.,yes,yes,no,Best UNH financial-report source; combine with archive page for 2010-2019. | Good core financial source,deep_research_report_10_official_ir_sources.csv|official_ir_sources_29_dow_tickers.csv,2,high_static_or_wp_candidate,static_html_or_custom,200,,crawler_ready,Use official company pages; respect robots and rate limits.,UNH|https://www.unitedhealthgroup.com/investors/financial-reports.html
UNH,UnitedHealth Group Incorporated,company_ir_hub,investor_home|investor_relations_hub,https://www.unitedhealthgroup.com/investors.html,https://www.unitedhealthgroup.com/investors.html,"Official UnitedHealth Group investor hub linking earnings, releases and reports. | Official UnitedHealth Group investor hub with links to reports archive and shareholder resources.",yes,yes,no,Hub/fallback for official IR materials. | Official company investor page,deep_research_report_10_official_ir_sources.csv|official_ir_sources_29_dow_tickers.csv,2,medium_static_candidate,static_html_or_custom,200,,crawler_ready,Use official company pages; respect robots and rate limits.,UNH|https://www.unitedhealthgroup.com/investors.html
UNH,UnitedHealth Group Incorporated,company_press_release_archive,company_press_releases,https://www.unitedhealthgroup.com/newsroom/press-releases.html,https://www.unitedhealthgroup.com/newsroom/press-releases.html,Official UnitedHealth Group press-release archive with dated full release pages.,yes,yes,no,Primary company/news source.,official_ir_sources_29_dow_tickers.csv,1,medium_static_duplicate,static_html_or_custom,200,,crawler_ready,Use official company pages; respect robots and rate limits.,UNH|https://www.unitedhealthgroup.com/newsroom/press-releases.html
VZ,Verizon Communications Inc.,company_earnings_archive,earnings_results_archive|quarterly_earnings,https://www.verizon.com/about/investors/quarterly-earnings,https://www.verizon.com/about/investors/quarterly-earnings,"Official Verizon quarterly earnings archive with dated earnings releases, webcasts and financial materials. | Official Verizon quarterly earnings archive with presentations financial statements and transcripts.",yes,yes,no,Best VZ earnings-results source for Train/OOS windows. | Good fit for 2021-2023 and adjacent years,deep_research_report_10_official_ir_sources.csv|official_ir_sources_29_dow_tickers.csv,2,high_static_candidate,static_html_or_custom,200,,crawler_ready,Use official company pages; respect robots and rate limits.,VZ|https://www.verizon.com/about/investors/quarterly-earnings
VZ,Verizon Communications Inc.,company_ir_hub,investor_relations_hub,https://www.verizon.com/about/investors,https://www.verizon.com/about/investors,"Official Verizon investor relations hub linking events, financial reporting and news.",yes,yes,no,Hub/fallback; prefer quarterly earnings and investor-news pages for extraction.,official_ir_sources_29_dow_tickers.csv,1,high_static_candidate,quotemedia,200,,crawler_ready,Use official company pages; respect robots and rate limits.,VZ|https://www.verizon.com/about/investors
VZ,Verizon Communications Inc.,company_news_archive,investor_news,https://www.verizon.com/about/investors/investor-news,https://www.verizon.com/about/investors/investor-news,Official Verizon investor-news archive with dated investor releases.,yes,yes,no,Use for financial/investor-specific releases.,official_ir_sources_29_dow_tickers.csv,1,high_static_candidate,static_html_or_custom,200,,crawler_ready,Use official company pages; respect robots and rate limits.,VZ|https://www.verizon.com/about/investors/investor-news
VZ,Verizon Communications Inc.,company_press_release_archive,company_news_archive,https://www.verizon.com/about/news,https://www.verizon.com/about/news,Official Verizon newsroom with latest company news and stories.,yes,yes,no,Official company newsroom,deep_research_report_10_official_ir_sources.csv,1,high_static_or_wp_candidate,static_html_or_custom,200,,crawler_ready,Use official company pages; respect robots and rate limits.,VZ|https://www.verizon.com/about/news
VZ,Verizon Communications Inc.,company_press_release_archive,ir_press_releases_archive|press_releases,https://www.verizon.com/about/news/press-releases,https://www.verizon.com/about/news/press-releases,Official Verizon press-release archive with dated full release pages. | Official Verizon press release archive with explicit year filter including 2010-2026.,yes,yes,no,Primary company-news source. | Very strong fit for long historical coverage,deep_research_report_10_official_ir_sources.csv|official_ir_sources_29_dow_tickers.csv,2,high_static_or_wp_candidate,static_html_or_custom,200,,crawler_ready,Use official company pages; respect robots and rate limits.,VZ|https://www.verizon.com/about/news/press-releases
WMT,Walmart Inc.,company_press_release_archive,company_news_archive|corporate_news_archive,https://corporate.walmart.com/news,https://corporate.walmart.com/news,Official Walmart corporate news archive with dated company releases and posts. | Official Walmart newsroom with dated corporate announcements and finance-tagged news.,yes,yes,no,Primary Walmart company-news source. | Official company newsroom,deep_research_report_10_official_ir_sources.csv|official_ir_sources_29_dow_tickers.csv,2,medium_static_duplicate,q4_or_q4_like,200,,crawler_ready,Use official company pages; respect robots and rate limits.,WMT|https://corporate.walmart.com/news
